{
  "schema_version": "1.0.0",
  "rollback_id": "rollback_follow001",
  "passport_id": "fp_alex2026",
  "passport_version": 1,
  "account": {
    "platform": "feed_passport_lab",
    "account_ref": "lab.destination"
  },
  "status": "complete",
  "started_at": "2026-08-29T14:00:00Z",
  "completed_at": "2026-08-29T14:00:01Z",
  "requested_receipt_ids": [
    "receipt_follow001"
  ],
  "results": [
    {
      "action_receipt_id": "receipt_follow001",
      "outcome": "restored",
      "restored_state": {
        "state_kind": "creator_follow",
        "exists": false,
        "value": null,
        "captured_at": "2026-08-29T14:00:01Z"
      },
      "residual_effects": []
    }
  ],
  "summary": {
    "requested": 1,
    "restored": 1,
    "not_reversible": 0,
    "already_restored": 0,
    "failed": 0
  },
  "platform_learning_rollback": "not_applicable",
  "learning_disclaimer": "The deterministic Lab has no hidden platform-learning state.",
  "credentials_included": false
}
